{
  "schema": "tts-evaluation-report/v1",
  "fixture": true,
  "note": "I03 PIPELINE CHECK, NOT A QUALITY BENCHMARK. Full T06 corpus run through the worker provider benchmark (CliTtsProvider) with a fake ffmpeg sine-tone command standing in for a voice, because Piper voice downloads are blocked (HTTP 403) in this environment. Timings and automated checks describe the tone, not speech; no human ratings, so every gate fails with missing-human-ratings by design. Re-run with a real provider + blind review before any provider decision (ADR 0011).",
  "corpus": {
    "datasetId": "damsen-tts-eval",
    "version": "1.0.0",
    "thresholdsVersion": "1.0.0"
  },
  "reports": [
    {
      "provider": "e2e-tone",
      "model": "ffmpeg-sine",
      "modelVersion": "e2e-tone-2026.10.0",
      "voiceId": "tone-vi",
      "locale": "vi",
      "count": 24,
      "ok": 24,
      "failed": 0,
      "p50GenerationMs": 81,
      "p95GenerationMs": 94,
      "meanRealTimeFactor": 0.04075,
      "totalSizeBytes": 2118672,
      "samples": [
        {
          "id": "vi-poi-001",
          "category": "poi-name",
          "ok": true,
          "generationMs": 94,
          "durationSeconds": 2,
          "realTimeFactor": 0.047,
          "sizeBytes": 88278,
          "automatedChecks": {
            "decodable": true,
            "clippedSampleRatio": 0.0,
            "leadingSilenceSeconds": 0.0,
            "trailingSilenceSeconds": 0.0,
            "internalSilenceRatio": 0.0
          }
        },
        {
          "id": "vi-poi-002",
          "category": "poi-name",
          "ok": true,
          "generationMs": 90,
          "durationSeconds": 2,
          "realTimeFactor": 0.045,
          "sizeBytes": 88278,
          "automatedChecks": {
            "decodable": true,
            "clippedSampleRatio": 0.0,
            "leadingSilenceSeconds": 0.0,
            "trailingSilenceSeconds": 0.0,
            "internalSilenceRatio": 0.0
          }
        },
        {
          "id": "vi-poi-003",
          "category": "poi-name",
          "ok": true,
          "generationMs": 79,
          "durationSeconds": 2,
          "realTimeFactor": 0.0395,
          "sizeBytes": 88278,
          "automatedChecks": {
            "decodable": true,
            "clippedSampleRatio": 0.0,
            "leadingSilenceSeconds": 0.0,
            "trailingSilenceSeconds": 0.0,
            "internalSilenceRatio": 0.0
          }
        },
        {
          "id": "vi-poi-004",
          "category": "poi-name",
          "ok": true,
          "generationMs": 78,
          "durationSeconds": 2,
          "realTimeFactor": 0.039,
          "sizeBytes": 88278,
          "automatedChecks": {
            "decodable": true,
            "clippedSampleRatio": 0.0,
            "leadingSilenceSeconds": 0.0,
            "trailingSilenceSeconds": 0.0,
            "internalSilenceRatio": 0.0
          }
        },
        {
          "id": "vi-poi-005",
          "category": "poi-name",
          "ok": true,
          "generationMs": 77,
          "durationSeconds": 2,
          "realTimeFactor": 0.0385,
          "sizeBytes": 88278,
          "automatedChecks": {
            "decodable": true,
            "clippedSampleRatio": 0.0,
            "leadingSilenceSeconds": 0.0,
            "trailingSilenceSeconds": 0.0,
            "internalSilenceRatio": 0.0
          }
        },
        {
          "id": "vi-place-001",
          "category": "place-name",
          "ok": true,
          "generationMs": 81,
          "durationSeconds": 2,
          "realTimeFactor": 0.0405,
          "sizeBytes": 88278,
          "automatedChecks": {
            "decodable": true,
            "clippedSampleRatio": 0.0,
            "leadingSilenceSeconds": 0.0,
            "trailingSilenceSeconds": 0.0,
            "internalSilenceRatio": 0.0
          }
        },
        {
          "id": "vi-place-002",
          "category": "place-name",
          "ok": true,
          "generationMs": 74,
          "durationSeconds": 2,
          "realTimeFactor": 0.037,
          "sizeBytes": 88278,
          "automatedChecks": {
            "decodable": true,
            "clippedSampleRatio": 0.0,
            "leadingSilenceSeconds": 0.0,
            "trailingSilenceSeconds": 0.0,
            "internalSilenceRatio": 0.0
          }
        },
        {
          "id": "vi-number-001",
          "category": "number-date",
          "ok": true,
          "generationMs": 84,
          "durationSeconds": 2,
          "realTimeFactor": 0.042,
          "sizeBytes": 88278,
          "automatedChecks": {
            "decodable": true,
            "clippedSampleRatio": 0.0,
            "leadingSilenceSeconds": 0.0,
            "trailingSilenceSeconds": 0.0,
            "internalSilenceRatio": 0.0
          }
        },
        {
          "id": "vi-number-002",
          "category": "number-date",
          "ok": true,
          "generationMs": 77,
          "durationSeconds": 2,
          "realTimeFactor": 0.0385,
          "sizeBytes": 88278,
          "automatedChecks": {
            "decodable": true,
            "clippedSampleRatio": 0.0,
            "leadingSilenceSeconds": 0.0,
            "trailingSilenceSeconds": 0.0,
            "internalSilenceRatio": 0.0
          }
        },
        {
          "id": "vi-number-003",
          "category": "number-date",
          "ok": true,
          "generationMs": 81,
          "durationSeconds": 2,
          "realTimeFactor": 0.0405,
          "sizeBytes": 88278,
          "automatedChecks": {
            "decodable": true,
            "clippedSampleRatio": 0.0,
            "leadingSilenceSeconds": 0.0,
            "trailingSilenceSeconds": 0.0,
            "internalSilenceRatio": 0.0
          }
        },
        {
          "id": "vi-number-004",
          "category": "number-date",
          "ok": true,
          "generationMs": 80,
          "durationSeconds": 2,
          "realTimeFactor": 0.04,
          "sizeBytes": 88278,
          "automatedChecks": {
            "decodable": true,
            "clippedSampleRatio": 0.0,
            "leadingSilenceSeconds": 0.0,
            "trailingSilenceSeconds": 0.0,
            "internalSilenceRatio": 0.0
          }
        },
        {
          "id": "vi-abbr-001",
          "category": "abbreviation",
          "ok": true,
          "generationMs": 82,
          "durationSeconds": 2,
          "realTimeFactor": 0.041,
          "sizeBytes": 88278,
          "automatedChecks": {
            "decodable": true,
            "clippedSampleRatio": 0.0,
            "leadingSilenceSeconds": 0.0,
            "trailingSilenceSeconds": 0.0,
            "internalSilenceRatio": 0.0
          }
        },
        {
          "id": "vi-abbr-002",
          "category": "abbreviation",
          "ok": true,
          "generationMs": 86,
          "durationSeconds": 2,
          "realTimeFactor": 0.043,
          "sizeBytes": 88278,
          "automatedChecks": {
            "decodable": true,
            "clippedSampleRatio": 0.0,
            "leadingSilenceSeconds": 0.0,
            "trailingSilenceSeconds": 0.0,
            "internalSilenceRatio": 0.0
          }
        },
        {
          "id": "vi-abbr-003",
          "category": "abbreviation",
          "ok": true,
          "generationMs": 73,
          "durationSeconds": 2,
          "realTimeFactor": 0.0365,
          "sizeBytes": 88278,
          "automatedChecks": {
            "decodable": true,
            "clippedSampleRatio": 0.0,
            "leadingSilenceSeconds": 0.0,
            "trailingSilenceSeconds": 0.0,
            "internalSilenceRatio": 0.0
          }
        },
        {
          "id": "vi-abbr-004",
          "category": "abbreviation",
          "ok": true,
          "generationMs": 96,
          "durationSeconds": 2,
          "realTimeFactor": 0.048,
          "sizeBytes": 88278,
          "automatedChecks": {
            "decodable": true,
            "clippedSampleRatio": 0.0,
            "leadingSilenceSeconds": 0.0,
            "trailingSilenceSeconds": 0.0,
            "internalSilenceRatio": 0.0
          }
        },
        {
          "id": "vi-codeswitch-001",
          "category": "code-switch",
          "ok": true,
          "generationMs": 93,
          "durationSeconds": 2,
          "realTimeFactor": 0.0465,
          "sizeBytes": 88278,
          "automatedChecks": {
            "decodable": true,
            "clippedSampleRatio": 0.0,
            "leadingSilenceSeconds": 0.0,
            "trailingSilenceSeconds": 0.0,
            "internalSilenceRatio": 0.0
          }
        },
        {
          "id": "vi-codeswitch-002",
          "category": "code-switch",
          "ok": true,
          "generationMs": 78,
          "durationSeconds": 2,
          "realTimeFactor": 0.039,
          "sizeBytes": 88278,
          "automatedChecks": {
            "decodable": true,
            "clippedSampleRatio": 0.0,
            "leadingSilenceSeconds": 0.0,
            "trailingSilenceSeconds": 0.0,
            "internalSilenceRatio": 0.0
          }
        },
        {
          "id": "vi-codeswitch-003",
          "category": "code-switch",
          "ok": true,
          "generationMs": 65,
          "durationSeconds": 2,
          "realTimeFactor": 0.0325,
          "sizeBytes": 88278,
          "automatedChecks": {
            "decodable": true,
            "clippedSampleRatio": 0.0,
            "leadingSilenceSeconds": 0.0,
            "trailingSilenceSeconds": 0.0,
            "internalSilenceRatio": 0.0
          }
        },
        {
          "id": "vi-punct-001",
          "category": "punctuation",
          "ok": true,
          "generationMs": 92,
          "durationSeconds": 2,
          "realTimeFactor": 0.046,
          "sizeBytes": 88278,
          "automatedChecks": {
            "decodable": true,
            "clippedSampleRatio": 0.0,
            "leadingSilenceSeconds": 0.0,